{
  "schemaVersion": "1.0.0",
  "id": "handoff-assessment-sample",
  "provenance": {
    "type": "alignment-assessment",
    "assessmentId": "assessment-136-64195c0"
  },
  "capabilityIds": ["sample-capability"],
  "source": {
    "repository": "Azure/bicep-ptn-aiml-landing-zone",
    "ref": "v2.6.1",
    "commitSha": "64195c01b70974fa7256c2f54a0035fb06804139"
  },
  "target": {
    "repository": "Azure/terraform-azurerm-avm-ptn-aiml-landing-zone",
    "ref": "main",
    "commitSha": "abe337894f93de3ddda525ea44898b33e1484070"
  },
  "requiredBehavior": ["Preserve the sanitized sample behavior."],
  "compatibilityConstraints": ["Preserve existing inputs and outputs."],
  "defaultBehavior": ["Preserve existing defaults."],
  "migrationPlan": ["No migration is intended."],
  "scenarioAcceptance": {
    "standalone-standard": ["Static fixture validation succeeds."],
    "standalone-network-isolated": ["Isolation requirements remain scenario-specific."]
  },
  "identityRequirements": ["Use managed identity."],
  "rbacRequirements": ["Use least-privilege RBAC."],
  "networkingRequirements": ["Keep scenario networking independent."],
  "securityInvariants": ["Do not introduce credentials or public access."],
  "avmRequirements": ["Run target-repository AVM validation."],
  "acceptanceCriteria": ["Produce a human-reviewable proposal."],
  "evidenceRequirements": {
    "standalone-standard": ["Require separate deployment and reviewed comparison evidence."],
    "standalone-network-isolated": ["Require separate deployment and reviewed isolation comparison evidence."]
  },
  "owner": {
    "source": "AI Landing Zone maintainers",
    "target": "Terraform AI Landing Zone maintainers"
  },
  "semanticVersionExpectation": "minor",
  "migrationRequired": false,
  "excludedScenarios": ["hub-spoke"],
  "exclusions": ["Do not include hub-spoke."],
  "approval": {
    "status": "pending"
  }
}
