{
  "schemaVersion": "1.0.0",
  "id": "handoff-baseline-sample",
  "provenance": {
    "type": "baseline-inventory",
    "baselineId": "baseline-v2.6.1-v0.5.1",
    "inventoryDigest": {
      "algorithm": "sha256",
      "value": "3e20da2c4cd16143793c52814e839d56c4604a62b185f64b6630be2943ba7273"
    },
    "inventoryCommitSha": "64195c01b70974fa7256c2f54a0035fb06804139",
    "inventoryReviewUrl": "https://github.com/Azure/bicep-ptn-aiml-landing-zone/pull/999"
  },
  "capabilityIds": ["sample-capability"],
  "source": {
    "repository": "Azure/bicep-ptn-aiml-landing-zone",
    "ref": "v2.6.1",
    "commitSha": "64195c01b70974fa7256c2f54a0035fb06804139"
  },
  "target": {
    "repository": "Azure/terraform-azurerm-avm-ptn-aiml-landing-zone",
    "ref": "main",
    "commitSha": "abe337894f93de3ddda525ea44898b33e1484070"
  },
  "requiredBehavior": ["Preserve the sanitized sample behavior."],
  "compatibilityConstraints": ["Preserve existing inputs and outputs."],
  "defaultBehavior": ["Preserve existing defaults."],
  "migrationPlan": ["No migration is intended."],
  "scenarioAcceptance": {
    "standalone-standard": ["Static fixture validation succeeds."],
    "standalone-network-isolated": ["Isolation requirements remain scenario-specific."]
  },
  "identityRequirements": ["Use managed identity."],
  "rbacRequirements": ["Use least-privilege RBAC."],
  "networkingRequirements": ["Keep scenario networking independent."],
  "securityInvariants": ["Do not introduce credentials or public access."],
  "avmRequirements": ["Run target-repository AVM validation."],
  "acceptanceCriteria": ["Produce a human-reviewable proposal."],
  "evidenceRequirements": {
    "standalone-standard": ["Require separate deployment and reviewed comparison evidence."],
    "standalone-network-isolated": ["Require separate deployment and reviewed isolation comparison evidence."]
  },
  "owner": {
    "source": "AI Landing Zone maintainers",
    "target": "Terraform AI Landing Zone maintainers"
  },
  "semanticVersionExpectation": "minor",
  "migrationRequired": false,
  "excludedScenarios": ["hub-spoke"],
  "exclusions": ["Do not include hub-spoke."],
  "approval": {
    "status": "approved",
    "approvalUrl": "https://github.com/Azure/bicep-ptn-aiml-landing-zone/pull/999",
    "approvedBy": "parity-reviewer",
    "approvedAt": "2026-08-21T18:39:46Z"
  }
}
